{
  "schemaVersion": 1,
  "taskId": "20260728-001-control-center-analysis",
  "enterpriseId": "ai-digital-employee-control-center",
  "version": 1,
  "enterpriseSnapshot": {
    "objective": "建立AI数字员工控制中心当前组织建设和能力成熟度的可追溯诊断基线",
    "offerings": [
      "统一任务路由与组织归属",
      "AI掌舵官、AI增长战略官、AI成交官、AI组织官、AI品牌官",
      "十五个组织核心技能",
      "普通宣传海报和淘宝电商套图公共能力"
    ],
    "customers": [
      "帝王",
      "经帝王授权的企业使用者"
    ],
    "revenueLogic": "项目内没有经授权的收入、成本、利润、现金流和外部付费验证数据，因此保持未知。",
    "stage": "organization-foundation-and-pilot"
  },
  "evidenceLedger": [
    {
      "id": "E-001",
      "factClass": "fact",
      "statement": "项目采用一个控制中心、五个业务组织、十五个核心技能和公共技能库的结构",
      "sourceRef": "AGENTS.md",
      "observedAt": "2026-07-28T00:00:00.000Z",
      "confidence": "high"
    },
    {
      "id": "E-002",
      "factClass": "fact",
      "statement": "控制中心注册表当前固定登记五个组织，每个组织三个核心技能",
      "sourceRef": "control-center/registries/organizations.json",
      "observedAt": "2026-07-28T00:00:00.000Z",
      "confidence": "high"
    },
    {
      "id": "E-003",
      "factClass": "fact",
      "statement": "未达到operational的组织不得承接正式执行，必须使用fallback_existing",
      "sourceRef": "AGENTS.md",
      "observedAt": "2026-07-28T00:00:00.000Z",
      "confidence": "high"
    },
    {
      "id": "E-004",
      "factClass": "fact",
      "statement": "本次AI掌舵官企业分析知识前置真实返回no_hit",
      "sourceRef": "organizations/ai-helmsman/tasks/ai-digital-employee-control-center/20260728-001-control-center-analysis/evidence/knowledge_context.json",
      "observedAt": "2026-07-28T00:00:00.000Z",
      "confidence": "high"
    },
    {
      "id": "E-005",
      "factClass": "inference",
      "statement": "控制中心当前优先事项应是逐组织完成真实试运行和门禁验证，而不是把全部技能同时标记为正式",
      "sourceRef": "docs/superpowers/specs/2026-07-28-ai-helmsman-design.md",
      "observedAt": "2026-07-28T00:00:00.000Z",
      "confidence": "medium"
    }
  ],
  "unknowns": [
    {
      "question": "五个业务组织分别需要多少真实任务才能满足operational门槛",
      "impact": "决定整体控制中心正式接单时间和验证资源",
      "owner": "emperor"
    },
    {
      "question": "控制中心未来的真实收入、成本、利润和现金流目标是什么",
      "impact": "决定商业模式和资源配置是否成立",
      "owner": "emperor"
    },
    {
      "question": "首批外部企业客户和付费验证场景是什么",
      "impact": "决定能力优先级、产品化范围和增长路径",
      "owner": "emperor"
    }
  ],
  "externalContext": [
    {
      "dimension": "market",
      "finding": "本次没有读取到可直接用于本项目战略判断的飞书或外部市场正文，市场规模与竞争结论保持未知",
      "factClass": "unknown",
      "evidenceRefs": [
        "E-004"
      ]
    }
  ],
  "internalCapabilities": [
    {
      "area": "control-center-routing",
      "rating": "implemented-and-regression-tested",
      "evidenceRefs": [
        "E-001",
        "E-002",
        "E-003"
      ],
      "constraints": [
        "非operational组织仍需回退到现有成熟能力链路"
      ]
    },
    {
      "area": "organization-development",
      "rating": "mixed-maturity",
      "evidenceRefs": [
        "E-002",
        "E-005"
      ],
      "constraints": [
        "各组织真实试运行和正式Skill成熟度不同"
      ]
    }
  ],
  "metricBaseline": [
    {
      "metric": "registered_organizations",
      "value": 5,
      "unit": "organizations",
      "status": "confirmed",
      "evidenceRefs": [
        "E-002"
      ]
    },
    {
      "metric": "registered_core_skills",
      "value": 15,
      "unit": "skills",
      "status": "confirmed",
      "evidenceRefs": [
        "E-001",
        "E-002"
      ]
    },
    {
      "metric": "revenue",
      "value": null,
      "unit": "CNY",
      "status": "unknown",
      "evidenceRefs": []
    }
  ],
  "issueTree": [
    {
      "issue": "组织注册完成度高于真实业务成熟度",
      "causes": [
        "五组织和十五技能的身份已固化，但多个组织仍处于planned、designing或pilot"
      ],
      "impacts": [
        "控制中心必须持续fallback_existing，不能统一宣布正式接单"
      ],
      "evidenceRefs": [
        "E-002",
        "E-003"
      ],
      "priority": "high"
    },
    {
      "issue": "商业化与经营指标基线缺失",
      "causes": [
        "项目内没有经授权的收入、成本、利润、客户和付费验证数据"
      ],
      "impacts": [
        "当前不能形成可信商业模式和资源配置结论"
      ],
      "evidenceRefs": [
        "E-004",
        "E-005"
      ],
      "priority": "high"
    },
    {
      "issue": "组织升级顺序需要统一经营主线",
      "causes": [
        "不同组织建设深度和试运行状态不一致"
      ],
      "impacts": [
        "若没有统一优先级，可能分散真实任务、测试和维护资源"
      ],
      "evidenceRefs": [
        "E-002",
        "E-005"
      ],
      "priority": "medium"
    }
  ],
  "strengths": [
    {
      "statement": "控制中心的五组织、十五技能、唯一主责和公共技能边界已经写入权威项目规则",
      "evidenceRefs": [
        "E-001",
        "E-002"
      ]
    },
    {
      "statement": "非operational组织的回退机制已经避免把设计状态冒充正式能力",
      "evidenceRefs": [
        "E-003"
      ]
    }
  ],
  "constraints": [
    {
      "statement": "当前没有足够经营和客户数据支持确定性商业模式或资源配置结论",
      "evidenceRefs": [
        "E-004",
        "E-005"
      ]
    },
    {
      "statement": "多个组织仍需通过真实任务、异常路径和回归测试才能升级",
      "evidenceRefs": [
        "E-002",
        "E-003"
      ]
    }
  ],
  "opportunities": [
    {
      "statement": "以AI掌舵官企业分析为统一入口，可以把各组织成熟度、证据和升级顺序纳入同一经营主线",
      "evidenceRefs": [
        "E-001",
        "E-005"
      ]
    }
  ],
  "risks": [
    {
      "statement": "在缺少真实客户和财务证据时同时推进全部组织正式化，可能产生虚假成熟度和维护负担",
      "evidenceRefs": [
        "E-003",
        "E-004",
        "E-005"
      ]
    },
    {
      "statement": "把知识前置no_hit误写成已获得行业依据，会直接破坏战略结论可信度",
      "evidenceRefs": [
        "E-004"
      ]
    }
  ],
  "coreProblems": [
    {
      "problem": "缺少按真实业务价值和验证证据排序的组织升级路线图",
      "priority": 1,
      "evidenceRefs": [
        "E-002",
        "E-003",
        "E-005"
      ],
      "decisionRequired": true
    },
    {
      "problem": "缺少支持商业模式判断的真实客户与财务指标基线",
      "priority": 2,
      "evidenceRefs": [
        "E-004",
        "E-005"
      ],
      "decisionRequired": true
    },
    {
      "problem": "缺少五组织联合完成真实跨组织经营任务的验证证据",
      "priority": 3,
      "evidenceRefs": [
        "E-001",
        "E-003"
      ],
      "decisionRequired": false
    }
  ],
  "downstreamBrief": {
    "strategyPlanning": {
      "inputs": [
        "五组织和十五技能的真实成熟度",
        "非operational组织回退边界",
        "真实任务与测试证据",
        "客户和财务未知项"
      ],
      "decisionsNeeded": [
        "确定未来一个阶段优先验证的业务组织",
        "确定首个跨组织真实经营任务",
        "确定真实客户和经营指标的授权范围"
      ]
    },
    "businessModel": {
      "inputs": [
        "目标客户与付费场景",
        "产品化能力范围",
        "交付成本和维护资源",
        "收入、成本、利润和现金流证据"
      ],
      "experimentsNeeded": [
        "完成首个授权企业的付费或价值验证",
        "记录真实交付时间、工具成本和复用率",
        "验证单个组织与跨组织任务的价值差异"
      ]
    }
  },
  "decisionsRequired": [
    {
      "decision": "是否采用本次企业分析作为后续战略规划的事实基线",
      "owner": "emperor",
      "executed": false
    },
    {
      "decision": "是否授权下一阶段补充真实客户、收入、成本和交付数据",
      "owner": "emperor",
      "executed": false
    }
  ],
  "createdAt": "2026-07-28T00:00:00.000Z"
}
